{"$schema":"https://json-schema.org/draft/2020-12/schema","$id":"https://padrao-laudos-periciais.local/schemas/plano-vistoria.schema.json","title":"Plano autônomo de vistoria pericial","type":"object","required":["schema_version","identificacao","processo_cnj","tipo_pericia","tema_controvertido","objeto","questoes_tecnicas","quesitos_relacionados","alegacoes_relacionadas","documentos_relevantes","documentos_ausentes","conhecimento_recuperado","ressalvas","conflitos","atividades","equipamentos","medicoes","fotografias","ensaios","documentos_a_solicitar","seguranca_e_acesso","pontos_criticos","pendencias","cobertura","requisitos_cobertura","autonomia","status","proveniencia"],"additionalProperties":false,"properties":{"schema_version":{"const":"2.0.0"},"identificacao":{"type":"object","required":["gerado_em","processo_sha256","delimitacao_sha256"],"additionalProperties":false,"properties":{"gerado_em":{"type":"string","format":"date-time"},"processo_sha256":{"$ref":"#/$defs/hash"},"delimitacao_sha256":{"$ref":"#/$defs/hash"}}},"processo_cnj":{"$ref":"pje-comum.schema.json#/$defs/numeroCnj"},"tipo_pericia":{"type":"string"},"tema_controvertido":{"type":"string"},"objeto":{"type":"string"},"questoes_tecnicas":{"type":"array","minItems":1,"items":{"type":"string","pattern":"^QT-[0-9]{3,}$"}},"quesitos_relacionados":{"type":"array","items":{"type":"string","pattern":"^QUE-[0-9]{3,}$"}},"alegacoes_relacionadas":{"type":"array","items":{"type":"string","pattern":"^ALG-[0-9]{3,}$"}},"documentos_relevantes":{"type":"array","items":{"type":"string"}},"documentos_ausentes":{"type":"array","items":{"type":"string"}},"conhecimento_recuperado":{"type":"array","items":{"$ref":"#/$defs/conhecimento"}},"ressalvas":{"type":"array","items":{"type":"string","pattern":"^RES-[0-9]{3,}$"}},"conflitos":{"type":"array","items":{"type":"string","pattern":"^CNF-[0-9]{3,}$"}},"atividades":{"type":"array","minItems":1,"items":{"$ref":"#/$defs/atividade"}},"equipamentos":{"type":"array","items":{"$ref":"#/$defs/equipamento"}},"medicoes":{"type":"array","items":{"$ref":"#/$defs/medicao"}},"fotografias":{"type":"array","items":{"$ref":"#/$defs/fotografia"}},"ensaios":{"type":"array","items":{"$ref":"#/$defs/ensaio"}},"documentos_a_solicitar":{"type":"array","items":{"$ref":"#/$defs/documentoPlanejado"}},"seguranca_e_acesso":{"type":"array","items":{"type":"string"}},"pontos_criticos":{"type":"array","items":{"type":"string"}},"pendencias":{"type":"array","items":{"type":"string"}},"cobertura":{"type":"array","items":{"$ref":"#/$defs/cobertura"}},"requisitos_cobertura":{"type":"array","items":{"$ref":"#/$defs/requisitoCobertura"}},"autonomia":{"$ref":"#/$defs/autonomia"},"status":{"enum":["APTO_PARA_VISTORIA","APTO_PARA_VISTORIA_COM_RESSALVAS","BLOQUEADO_PARA_VISTORIA"]},"proveniencia":{"type":"array","minItems":1,"items":{"$ref":"pje-comum.schema.json#/$defs/proveniencia"}}},"$defs":{"hash":{"type":"string","pattern":"^[a-f0-9]{64}$"},"conhecimento":{"type":"object","required":["fonte","motivo_da_relevancia","tipo_de_uso","confianca"],"additionalProperties":false,"properties":{"fonte":{"type":"string","pattern":"^(NOR|MOD)-[0-9]{4,}$"},"motivo_da_relevancia":{"type":"string"},"tipo_de_uso":{"enum":["METODOLOGIA","PLANEJAMENTO","REFERENCIA_NORMATIVA","ESTRUTURA","CHECKLIST","REDACAO_FUTURA"]},"confianca":{"$ref":"pje-comum.schema.json#/$defs/confianca"}}},"atividade":{"type":"object","required":["id","verificar","justificativa","questoes_tecnicas","quesitos","alegacoes","metodo","fundamentos","evidencia_esperada","obrigatoriedade","consequencia_se_nao_realizada"],"additionalProperties":false,"properties":{"id":{"type":"string","pattern":"^ATV-[0-9]{3,}$"},"verificar":{"type":"string"},"justificativa":{"type":"string"},"questoes_tecnicas":{"type":"array","minItems":1,"items":{"type":"string","pattern":"^QT-[0-9]{3,}$"}},"quesitos":{"type":"array","items":{"type":"string","pattern":"^QUE-[0-9]{3,}$"}},"alegacoes":{"type":"array","items":{"type":"string","pattern":"^ALG-[0-9]{3,}$"}},"metodo":{"type":"string"},"fundamentos":{"type":"array","items":{"type":"string","pattern":"^(NOR|MOD)-[0-9]{4,}$"}},"evidencia_esperada":{"type":"string"},"obrigatoriedade":{"enum":["OBRIGATORIA","RECOMENDAVEL"]},"consequencia_se_nao_realizada":{"type":"string"}}},"equipamento":{"type":"object","required":["nome","finalidade","questoes_tecnicas"],"additionalProperties":false,"properties":{"nome":{"type":"string"},"finalidade":{"type":"string"},"questoes_tecnicas":{"type":"array","items":{"type":"string","pattern":"^QT-[0-9]{3,}$"}}}},"medicao":{"type":"object","required":["id","grandeza","local","motivo","instrumento_sugerido","precisao_necessaria","questoes_tecnicas","quesitos","criterio","obrigatoriedade","consequencia_ausencia"],"additionalProperties":false,"properties":{"id":{"type":"string","pattern":"^MED-PLANO-[0-9]{3,}$"},"grandeza":{"type":"string"},"local":{"type":"string"},"motivo":{"type":"string"},"instrumento_sugerido":{"type":"string"},"precisao_necessaria":{"type":["string","null"]},"questoes_tecnicas":{"type":"array","items":{"type":"string","pattern":"^QT-[0-9]{3,}$"}},"quesitos":{"type":"array","items":{"type":"string","pattern":"^QUE-[0-9]{3,}$"}},"criterio":{"type":["string","null"]},"obrigatoriedade":{"enum":["OBRIGATORIA","RECOMENDAVEL","CONDICIONAL"]},"consequencia_ausencia":{"type":"string"}}},"fotografia":{"type":"object","required":["id","finalidade","enquadramento","questoes_tecnicas","quesitos","alegacoes"],"additionalProperties":false,"properties":{"id":{"type":"string","pattern":"^FOT-PLANO-[0-9]{3,}$"},"finalidade":{"type":"string"},"enquadramento":{"type":"string"},"atividade":{"type":["string","null"],"pattern":"^ATV-[0-9]{3,}$"},"questoes_tecnicas":{"type":"array","items":{"type":"string","pattern":"^QT-[0-9]{3,}$"}},"quesitos":{"type":"array","items":{"type":"string","pattern":"^QUE-[0-9]{3,}$"}},"alegacoes":{"type":"array","items":{"type":"string","pattern":"^ALG-[0-9]{3,}$"}}}},"ensaio":{"type":"object","required":["id","nome","classificacao","justificativa","fundamento","questoes_tecnicas","conclusoes_limitadas_se_ausente"],"additionalProperties":false,"properties":{"id":{"type":"string","pattern":"^ENS-PLANO-[0-9]{3,}$"},"nome":{"type":"string"},"classificacao":{"enum":["ROTINEIRO","RECOMENDAVEL","CONDICIONAL","INDISPENSAVEL"]},"justificativa":{"type":"string"},"fundamento":{"type":["string","null"]},"questoes_tecnicas":{"type":"array","items":{"type":"string","pattern":"^QT-[0-9]{3,}$"}},"conclusoes_limitadas_se_ausente":{"type":"array","items":{"type":"string"}}}},"documentoPlanejado":{"type":"object","required":["id","descricao","questoes_tecnicas","criterio_satisfacao"],"additionalProperties":false,"properties":{"id":{"type":"string","pattern":"^DOC-PLANO-[0-9]{3,}$"},"descricao":{"type":"string","minLength":1},"questoes_tecnicas":{"type":"array","minItems":1,"items":{"type":"string","pattern":"^QT-[0-9]{3,}$"}},"criterio_satisfacao":{"type":"string","minLength":1}}},"cobertura":{"type":"object","required":["quesito","questoes_tecnicas","alegacoes","atividades","medicoes","fotografias","ensaios","documentos","planejada"],"additionalProperties":false,"properties":{"quesito":{"type":"string","pattern":"^QUE-[0-9]{3,}$"},"questoes_tecnicas":{"type":"array","items":{"type":"string","pattern":"^QT-[0-9]{3,}$"}},"alegacoes":{"type":"array","items":{"type":"string","pattern":"^ALG-[0-9]{3,}$"}},"atividades":{"type":"array","items":{"type":"string","pattern":"^ATV-[0-9]{3,}$"}},"medicoes":{"type":"array","items":{"type":"string","pattern":"^MED-PLANO-[0-9]{3,}$"}},"fotografias":{"type":"array","items":{"type":"string","pattern":"^FOT-PLANO-[0-9]{3,}$"}},"ensaios":{"type":"array","items":{"type":"string"}},"documentos":{"type":"array","items":{"type":"string"}},"planejada":{"type":"boolean"}}},"requisitoCobertura":{"type":"object","required":["questao_tecnica","tipo","obrigatoriedade"],"additionalProperties":false,"properties":{"questao_tecnica":{"type":"string","pattern":"^QT-[0-9]{3,}$"},"tipo":{"enum":["ATIVIDADE","MEDICAO","FOTOGRAFIA","ENSAIO","DOCUMENTO"]},"obrigatoriedade":{"enum":["OBRIGATORIA","RECOMENDAVEL"]},"item_planejado":{"type":"string","minLength":1}},"allOf":[{"if":{"properties":{"obrigatoriedade":{"const":"OBRIGATORIA"}}},"then":{"required":["item_planejado"]}}]},"autonomia":{"type":"object","required":["decisoes_autonomas","ressalvas_autonomas","lacunas_resolvidas_sem_perguntar","perguntas_evitadas_autonomamente","perguntas_realmente_necessarias"],"additionalProperties":false,"properties":{"decisoes_autonomas":{"type":"integer","minimum":0},"ressalvas_autonomas":{"type":"integer","minimum":0},"lacunas_resolvidas_sem_perguntar":{"type":"integer","minimum":0},"perguntas_evitadas_autonomamente":{"type":"array","items":{"type":"string"}},"perguntas_realmente_necessarias":{"type":"array","items":{"type":"object","required":["problema","tentativas","motivo_bloqueio","impacto","pergunta"],"additionalProperties":false,"properties":{"problema":{"type":"string"},"tentativas":{"type":"array","items":{"type":"string"}},"motivo_bloqueio":{"type":"string"},"impacto":{"type":"string"},"pergunta":{"type":"string"}}}}}}}}
