{"schema_version":"2.0.0","identificacao":{"gerado_em":"2026-01-01T12:00:00-03:00","processo_sha256":"0000000000000000000000000000000000000000000000000000000000000000","delimitacao_sha256":"0000000000000000000000000000000000000000000000000000000000000000"},"processo_cnj":"0000001-00.2026.4.00.0001","tipo_pericia":"VICIOS_CONSTRUTIVOS","tema_controvertido":"Tema fictício","objeto":"Imóvel fictício","questoes_tecnicas":["QT-001"],"quesitos_relacionados":["QUE-001"],"alegacoes_relacionadas":["ALG-001"],"documentos_relevantes":["DOC-PJE-001"],"documentos_ausentes":[],"conhecimento_recuperado":[],"ressalvas":[],"conflitos":[],"atividades":[{"id":"ATV-001","verificar":"Condição fictícia","justificativa":"Sanear QT fictícia","questoes_tecnicas":["QT-001"],"quesitos":["QUE-001"],"alegacoes":["ALG-001"],"metodo":"Inspeção fictícia","fundamentos":[],"evidencia_esperada":"Registro fictício","obrigatoriedade":"OBRIGATORIA","consequencia_se_nao_realizada":"Limitação fictícia"}],"equipamentos":[],"medicoes":[],"fotografias":[],"ensaios":[],"documentos_a_solicitar":[],"seguranca_e_acesso":[],"pontos_criticos":[],"pendencias":[],"cobertura":[{"quesito":"QUE-001","questoes_tecnicas":["QT-001"],"alegacoes":["ALG-001"],"atividades":["ATV-001"],"medicoes":[],"fotografias":[],"ensaios":[],"documentos":[],"planejada":true}],"requisitos_cobertura":[{"questao_tecnica":"QT-001","tipo":"ATIVIDADE","obrigatoriedade":"OBRIGATORIA","item_planejado":"ATV-001"}],"autonomia":{"decisoes_autonomas":1,"ressalvas_autonomas":0,"lacunas_resolvidas_sem_perguntar":0,"perguntas_evitadas_autonomamente":["tipo fictício"],"perguntas_realmente_necessarias":[]},"status":"APTO_PARA_VISTORIA","proveniencia":[{"arquivo":"processo-ficticio.pdf","sha256":"0000000000000000000000000000000000000000000000000000000000000000","documento_id":"DOC-PJE-001","id_pje":"900001","pagina_pdf":1,"pagina_documento":1,"pagina_original":null,"trecho":"Trecho fictício","natureza":"DOCUMENTADO","metodo_extracao":"TEXTO_DIGITAL","confianca":{"nivel":"ALTA"},"status_verificacao":"VERIFICADO"}]}
